{
  "研究主题": "半导体设备订单增长到收入确认传导",
  "材料范围": {
    "材料数量": 4,
    "独立原始来源数量": 3,
    "历史样本数量": 2,
    "来源去重说明": "两篇券商点评均引用同一公司 2025Q1 财报，按原始事实来源只计为一个来源；另有一篇行业深度和一个历史案例样本。"
  },
  "证据矩阵": [
    {
      "候选模板要素": "订单增长到收入确认传导",
      "要素类型": "传导逻辑",
      "标准化表述": "新签订单增长后，若交付和验收按期推进，未来 1-3 个季度收入确认概率提升。",
      "独立原始来源": [
        {
          "来源名称": "某半导体设备公司 2025Q1 财报",
          "来源类型": "财报",
          "原始事实来源": "公司定期报告",
          "发布时间": "2025-04-28",
          "证据位置": "订单与合同负债披露部分"
        },
        {
          "来源名称": "半导体设备行业深度",
          "来源类型": "研报",
          "原始事实来源": "行业订单样本统计",
          "发布时间": "2025-05-10",
          "证据位置": "第 18 页订单转收入章节"
        }
      ],
      "历史样本": [
        {
          "样本对象": "历史样本 A 设备公司",
          "触发时间": "2023Q2",
          "兑现或失效时间": "2023Q4",
          "验证指标": "收入确认增速和合同负债变化",
          "结果": "兑现",
          "失效原因": "未发生明显阻断",
          "来源位置": "行业深度第 19 页历史样本表"
        },
        {
          "样本对象": "历史样本 B 设备公司",
          "触发时间": "2024Q1",
          "兑现或失效时间": "2024Q3",
          "验证指标": "收入确认和毛利率",
          "结果": "部分兑现",
          "失效原因": "低毛利订单拖累利润传导",
          "来源位置": "行业深度第 20 页案例复盘"
        }
      ],
      "反证或阻断样本": ["低毛利订单导致利润传导弱于收入传导"],
      "适用范围": "半导体设备公司订单到收入确认链条，不直接推导利润改善。",
      "候选等级": "历史支持模板候选",
      "缺口": ["仍需专家确认不同设备环节的交付周期差异"]
    }
  ],
  "质量提示": [
    "该样例具备多来源和历史样本，但仍需专家确认设备环节差异。",
    "模板只描述订单到收入确认传导，不等同于投资建议。"
  ]
}
